{
  "$schema": "https://json-schema.org/draft/2020-12/schema",
  "$id": "https://openarcos.org/schemas/cdc_county_overdose.schema.json",
  "title": "CDC WONDER D76 county-year drug-overdose deaths (rich, scraped)",
  "description": "Full county × year × ICD-underlying-cause grid scraped from CDC WONDER's UCD interactive form. Source: pipeline/src/openarcos_pipeline/sources/cdc_wonder_scraper.py. Drug/alcohol-induced causes D1-D4 maps to ICD-10 X40-X44 + X60-X64 + X85 + Y10-Y14. Suppressed cells (NCHS ≤9 rule under 42 USC 242m(d)) preserved as deaths=null, suppressed=true. Unreliable-rate cells (NCHS ≤20 rule) preserved as unreliable=true with crude_rate=null.",
  "type": "object",
  "required": ["records", "methodology", "source", "fetched_at"],
  "additionalProperties": false,
  "properties": {
    "records": {
      "type": "array",
      "items": {
        "type": "object",
        "required": ["county_fips", "state_fips", "year", "population", "suppressed", "unreliable"],
        "additionalProperties": false,
        "properties": {
          "county_fips": {"type": "string", "pattern": "^[0-9]{5}$"},
          "county_name": {"type": "string"},
          "state_fips": {"type": "string", "pattern": "^[0-9]{2}$"},
          "year": {"type": "integer", "minimum": 1999, "maximum": 2030},
          "deaths": {"type": ["integer", "null"], "minimum": 0},
          "population": {"type": "integer", "minimum": 0},
          "crude_rate": {"type": ["number", "null"]},
          "crude_rate_lower_ci": {"type": ["number", "null"]},
          "crude_rate_upper_ci": {"type": ["number", "null"]},
          "suppressed": {"type": "boolean"},
          "unreliable": {"type": "boolean"}
        },
        "allOf": [
          {
            "description": "Suppressed cells never carry a numeric death count.",
            "if": {"properties": {"suppressed": {"const": true}}},
            "then": {"properties": {"deaths": {"type": "null"}}}
          },
          {
            "description": "Publishable non-suppressed cells must be at least 10 deaths.",
            "if": {"properties": {"suppressed": {"const": false}}},
            "then": {"properties": {"deaths": {"type": "integer", "minimum": 10}}}
          }
        ]
      }
    },
    "methodology": {
      "type": "string",
      "description": "Human-readable description of the query (ICD codes, years, group-by, suppression regime)."
    },
    "source": {
      "type": "string",
      "description": "CDC WONDER Underlying Cause of Death 1999-2020 landing URL."
    },
    "fetched_at": {
      "type": "string",
      "description": "ISO-8601 timestamp of the scrape run that produced these records."
    },
    "totals": {
      "type": "object",
      "description": "Summary counters for quick QA/telemetry.",
      "properties": {
        "records": {"type": "integer", "minimum": 0},
        "suppressed": {"type": "integer", "minimum": 0},
        "unreliable": {"type": "integer", "minimum": 0},
        "states": {"type": "integer", "minimum": 0}
      }
    }
  }
}
